{
  "version": "0.1",
  "fish": [
    {
      "id": "fish_01",
      "name_vi": "Cá chép",
      "scientific_name_candidate": "Cyprinus carpio",
      "aliases_vi": "",
      "release_scope": "MVP",
      "map_ids": "AO,HO,SONG",
      "depth_role": "bottom",
      "diet_role": "omnivore",
      "technique_ids": "don,dai,bottom",
      "bait_tags": "corn,dough,worm",
      "sim_weight_min_kg": 0.15,
      "sim_weight_max_kg": 7,
      "base_price_xu_per_kg": 22000,
      "biology_review_status": "pending_expert_review",
      "range_review_status": "pending_map_review",
      "notes": "Tên thông dụng; quần thể nuôi và tự nhiên tách ở cấp map."
    },
    {
      "id": "fish_02",
      "name_vi": "Cá diếc",
      "scientific_name_candidate": "Carassius auratus",
      "aliases_vi": "",
      "release_scope": "MVP",
      "map_ids": "AO,HO",
      "depth_role": "bottom",
      "diet_role": "omnivore",
      "technique_ids": "don,dai",
      "bait_tags": "worm,dough",
      "sim_weight_min_kg": 0.05,
      "sim_weight_max_kg": 1,
      "base_price_xu_per_kg": 26000,
      "biology_review_status": "pending_expert_review",
      "range_review_status": "pending_map_review",
      "notes": "Nhóm diếc cần kiểm tra định danh địa phương; chưa khóa taxon phát hành."
    },
    {
      "id": "fish_03",
      "name_vi": "Cá rô đồng",
      "scientific_name_candidate": "Anabas testudineus",
      "aliases_vi": "",
      "release_scope": "MVP",
      "map_ids": "AO,KENH,MT",
      "depth_role": "mid",
      "diet_role": "omnivore",
      "technique_ids": "don,dai",
      "bait_tags": "worm,cricket",
      "sim_weight_min_kg": 0.04,
      "sim_weight_max_kg": 0.45,
      "base_price_xu_per_kg": 30000,
      "biology_review_status": "pending_expert_review",
      "range_review_status": "pending_map_review",
      "notes": "Không nhập chung rô phi."
    },
    {
      "id": "fish_04",
      "name_vi": "Cá lóc",
      "scientific_name_candidate": "Channa striata",
      "aliases_vi": "",
      "release_scope": "MVP",
      "map_ids": "AO,KENH,HO,MT",
      "depth_role": "cover",
      "diet_role": "predator",
      "technique_ids": "lure,don",
      "bait_tags": "frog,softbait,livefish",
      "sim_weight_min_kg": 0.15,
      "sim_weight_max_kg": 5,
      "base_price_xu_per_kg": 34000,
      "biology_review_status": "pending_expert_review",
      "range_review_status": "pending_map_review",
      "notes": "Còn gọi cá quả ở một số vùng; tên hiển thị theo locale."
    },
    {
      "id": "fish_05",
      "name_vi": "Cá trê vàng",
      "scientific_name_candidate": "Clarias macrocephalus",
      "aliases_vi": "",
      "release_scope": "MVP",
      "map_ids": "AO,KENH,MT",
      "depth_role": "bottom",
      "diet_role": "omnivore",
      "technique_ids": "don,bottom",
      "bait_tags": "worm,shrimp",
      "sim_weight_min_kg": 0.08,
      "sim_weight_max_kg": 1.5,
      "base_price_xu_per_kg": 38000,
      "biology_review_status": "pending_expert_review",
      "range_review_status": "pending_map_review",
      "notes": "Trê lai là biến thể lai, không tính thêm loài."
    },
    {
      "id": "fish_06",
      "name_vi": "Cá rô phi vằn",
      "scientific_name_candidate": "Oreochromis niloticus",
      "aliases_vi": "",
      "release_scope": "MVP",
      "map_ids": "AO,KENH,HO,MT",
      "depth_role": "mid",
      "diet_role": "omnivore",
      "technique_ids": "don,dai",
      "bait_tags": "worm,dough",
      "sim_weight_min_kg": 0.1,
      "sim_weight_max_kg": 2,
      "base_price_xu_per_kg": 42000,
      "biology_review_status": "pending_expert_review",
      "range_review_status": "pending_map_review",
      "notes": "Điêu hồng không được tính là một loài thứ 51."
    },
    {
      "id": "fish_07",
      "name_vi": "Cá trắm cỏ",
      "scientific_name_candidate": "Ctenopharyngodon idella",
      "aliases_vi": "",
      "release_scope": "MVP",
      "map_ids": "AO,HO",
      "depth_role": "mid",
      "diet_role": "herbivore",
      "technique_ids": "dai,bottom",
      "bait_tags": "leaf,corn,dough",
      "sim_weight_min_kg": 0.4,
      "sim_weight_max_kg": 15,
      "base_price_xu_per_kg": 46000,
      "biology_review_status": "pending_expert_review",
      "range_review_status": "pending_map_review",
      "notes": "Ao/hồ thả nuôi; không khẳng định phổ biến mọi hệ sinh thái."
    },
    {
      "id": "fish_08",
      "name_vi": "Cá mè trắng",
      "scientific_name_candidate": "Hypophthalmichthys molitrix",
      "aliases_vi": "",
      "release_scope": "MVP",
      "map_ids": "AO,HO",
      "depth_role": "mid",
      "diet_role": "filter",
      "technique_ids": "dai,bottom",
      "bait_tags": "cloudbait",
      "sim_weight_min_kg": 0.3,
      "sim_weight_max_kg": 10,
      "base_price_xu_per_kg": 18000,
      "biology_review_status": "pending_expert_review",
      "range_review_status": "pending_map_review",
      "notes": "Lọc ăn; bắt bằng cụm mồi hấp dẫn là mô hình cần cần thủ duyệt, không giả làm cá săn mồi."
    },
    {
      "id": "fish_09",
      "name_vi": "Cá mè hoa",
      "scientific_name_candidate": "Hypophthalmichthys nobilis",
      "aliases_vi": "",
      "release_scope": "MVP",
      "map_ids": "AO,HO",
      "depth_role": "mid",
      "diet_role": "filter",
      "technique_ids": "bottom,dai",
      "bait_tags": "cloudbait",
      "sim_weight_min_kg": 0.4,
      "sim_weight_max_kg": 15,
      "base_price_xu_per_kg": 22000,
      "biology_review_status": "pending_expert_review",
      "range_review_status": "pending_map_review",
      "notes": "Không trùng mè trắng; trạng thái thả nuôi ở map hồ."
    },
    {
      "id": "fish_10",
      "name_vi": "Cá trôi Ấn Độ / rohu",
      "scientific_name_candidate": "Labeo rohita",
      "aliases_vi": "",
      "release_scope": "MVP",
      "map_ids": "AO,HO",
      "depth_role": "bottom",
      "diet_role": "omnivore",
      "technique_ids": "dai,bottom",
      "bait_tags": "dough,corn",
      "sim_weight_min_kg": 0.2,
      "sim_weight_max_kg": 6,
      "base_price_xu_per_kg": 26000,
      "biology_review_status": "pending_expert_review",
      "range_review_status": "pending_map_review",
      "notes": "Tên cá trôi chung có thể chỉ nhiều taxon; UI dùng tên đầy đủ."
    },
    {
      "id": "fish_11",
      "name_vi": "Cá sặc rằn",
      "scientific_name_candidate": "Trichopodus pectoralis",
      "aliases_vi": "",
      "release_scope": "MVP",
      "map_ids": "KENH,MT",
      "depth_role": "mid",
      "diet_role": "omnivore",
      "technique_ids": "don,dai",
      "bait_tags": "worm,dough",
      "sim_weight_min_kg": 0.05,
      "sim_weight_max_kg": 0.35,
      "base_price_xu_per_kg": 30000,
      "biology_review_status": "pending_expert_review",
      "range_review_status": "pending_map_review",
      "notes": "Catalog MVP; việc câu lưỡi và hình thái phải duyệt."
    },
    {
      "id": "fish_12",
      "name_vi": "Cá sặc bướm",
      "scientific_name_candidate": "Trichopodus trichopterus",
      "aliases_vi": "",
      "release_scope": "MVP",
      "map_ids": "KENH,MT",
      "depth_role": "mid",
      "diet_role": "omnivore",
      "technique_ids": "don",
      "bait_tags": "worm",
      "sim_weight_min_kg": 0.02,
      "sim_weight_max_kg": 0.12,
      "base_price_xu_per_kg": 34000,
      "biology_review_status": "pending_expert_review",
      "range_review_status": "pending_map_review",
      "notes": "Cá nhỏ; không dùng farm tiền bằng số lượng vô hạn."
    },
    {
      "id": "fish_13",
      "name_vi": "Cá trê đen",
      "scientific_name_candidate": "Clarias fuscus",
      "aliases_vi": "",
      "release_scope": "EXPANSION",
      "map_ids": "AO,SONG",
      "depth_role": "bottom",
      "diet_role": "omnivore",
      "technique_ids": "don,bottom",
      "bait_tags": "worm,shrimp",
      "sim_weight_min_kg": 0.1,
      "sim_weight_max_kg": 2,
      "base_price_xu_per_kg": 38000,
      "biology_review_status": "pending_expert_review",
      "range_review_status": "pending_map_review",
      "notes": "Đối chiếu tên địa phương trước khóa nội dung."
    },
    {
      "id": "fish_14",
      "name_vi": "Cá trê phi",
      "scientific_name_candidate": "Clarias gariepinus",
      "aliases_vi": "",
      "release_scope": "EXPANSION",
      "map_ids": "AO",
      "depth_role": "bottom",
      "diet_role": "predator",
      "technique_ids": "bottom",
      "bait_tags": "worm,livefish",
      "sim_weight_min_kg": 0.3,
      "sim_weight_max_kg": 12,
      "base_price_xu_per_kg": 42000,
      "biology_review_status": "pending_expert_review",
      "range_review_status": "pending_map_review",
      "notes": "Chỉ hồ dịch vụ thả nuôi; không thêm tự do vào map hoang dã."
    },
    {
      "id": "fish_15",
      "name_vi": "Cá tra",
      "scientific_name_candidate": "Pangasianodon hypophthalmus",
      "aliases_vi": "",
      "release_scope": "EXPANSION",
      "map_ids": "MT,HO",
      "depth_role": "mid",
      "diet_role": "omnivore",
      "technique_ids": "bottom,dai",
      "bait_tags": "dough,shrimp",
      "sim_weight_min_kg": 0.5,
      "sim_weight_max_kg": 20,
      "base_price_xu_per_kg": 46000,
      "biology_review_status": "pending_expert_review",
      "range_review_status": "pending_map_review",
      "notes": "Nhiều nội dung là cá nuôi; map dùng quần thể giả tưởng có nguồn gốc rõ."
    },
    {
      "id": "fish_16",
      "name_vi": "Cá basa",
      "scientific_name_candidate": "Pangasius bocourti",
      "aliases_vi": "",
      "release_scope": "EXPANSION",
      "map_ids": "MT",
      "depth_role": "mid",
      "diet_role": "omnivore",
      "technique_ids": "bottom",
      "bait_tags": "shrimp,dough",
      "sim_weight_min_kg": 0.5,
      "sim_weight_max_kg": 15,
      "base_price_xu_per_kg": 18000,
      "biology_review_status": "pending_expert_review",
      "range_review_status": "pending_map_review",
      "notes": "Tách cá tra ở định danh và hình dáng."
    },
    {
      "id": "fish_17",
      "name_vi": "Cá lăng đuôi đỏ",